{"$id":"https://example.org/schemas/ai_network_event.schema.json","$schema":"https://json-schema.org/draft/2020-12/schema","$title":"AI automation network policy event","additionalProperties":true,"description":"Policy events for the AI / Automation Trust Zone (VLAN 50, AI_AUTOMATION, 10.50.0.0/24). Supports the five-signal correlation model: human identity (delegating_user) + workload identity (workload_identity) + tool invocation (tool_name, mcp_server) + network flow (source, destination, protocol) + firewall decision (action, policy_id). Tool invocation fields are optional and are only populated when application-layer telemetry (agent or MCP audit logs) is available. The network layer alone cannot determine whether an AI prompt or tool invocation was malicious; it can only report that a network policy decision was made. Correlation of all five signals happens in an external SIEM.","properties":{"action":{"description":"Required. The firewall or ACL decision.","enum":["allow","deny"],"type":"string"},"correlation_id":{"description":"Optional. Opaque identifier for joining the network event with agent or MCP audit records.","type":"string"},"delegating_user":{"description":"Optional. Human identity that delegated the task to the agent, where application-layer telemetry provides it.","type":"string"},"destination":{"description":"Required. Where the traffic was directed.","properties":{"ip":{"description":"Required. Destination IP address.","type":"string"},"port":{"description":"Optional. Destination port.","maximum":65535,"minimum":1,"type":"integer"},"zone":{"description":"Optional. Destination network zone.","type":"string"}},"required":["ip"],"type":"object"},"event_type":{"const":"ai_policy_violation","description":"Required. Fixed value for this event family.","type":"string"},"mcp_server":{"description":"Optional. Identity of the MCP server involved in the tool invocation, where application-layer telemetry provides it.","type":"string"},"message":{"description":"Required. Human-readable summary. Must not contain secrets, prompts, or tool payloads.","type":"string"},"network_zone":{"const":"AI_AUTOMATION","description":"Optional. Zone label; AI zone events use AI_AUTOMATION.","type":"string"},"policy_id":{"description":"Required. Identifier of the firewall rule or ACL ACE that made the decision, for example AI_EGRESS_DENY.","type":"string"},"protocol":{"description":"Optional. Transport protocol.","enum":["tcp","udp","icmp","other"],"type":"string"},"severity":{"description":"Required. Severity assigned at the source.","enum":["low","medium","high","critical"],"type":"string"},"source":{"description":"Required. The AI workload that originated the traffic.","properties":{"device":{"description":"Optional. Device that generated the event, for example firewall.example.","type":"string"},"ip":{"description":"Required. Source IP address inside 10.50.0.0/24.","type":"string"},"zone":{"const":"AI_AUTOMATION","description":"Optional. Source zone for AI events.","type":"string"}},"required":["ip"],"type":"object"},"timestamp":{"description":"Required. RFC3339 UTC timestamp of when the event occurred.","format":"date-time","type":"string"},"tool_name":{"description":"Optional. Name of the tool invoked by the agent, where application-layer telemetry provides it. Absence means no application-layer telemetry was available, not that no tool was used.","type":"string"},"vlan":{"description":"Optional. Source VLAN ID; AI zone events use 50.","type":"integer"},"workload_identity":{"description":"Required. The non-human workload identity responsible for the traffic, for example an AI agent runner name.","type":"string"}},"required":["timestamp","event_type","severity","source","destination","action","policy_id","workload_identity","message"],"type":"object"}