{"action":"deny","correlation_id":"ai-20260101-122000","delegating_user":"operator@example.com","destination":{"ip":"203.0.113.99","port":443,"zone":"EXTERNAL"},"event_type":"ai_policy_violation","mcp_server":"mcp-tools.example","message":"AI workload attempted unapproved outbound connection; tool invocation fields are present only because application-layer telemetry was available","network_zone":"AI_AUTOMATION","policy_id":"AI_EGRESS_DENY","protocol":"tcp","severity":"high","source":{"device":"firewall.example","ip":"10.50.0.25","zone":"AI_AUTOMATION"},"timestamp":"2026-01-01T12:20:00Z","tool_name":"web_fetch","vlan":50,"workload_identity":"ai-agent-runner-01"}